{
  "entries": [
    {
      "canonicalPaths": [
        "agents/kotlin-review/kotlin-boundary-contract-reviewer.agent.md"
      ],
      "coverageStatus": "PLUGIN_COMPOSED",
      "marketplaceReferences": [],
      "pluginReferences": [
        {
          "pluginName": "kotlin-review",
          "primitivePath": "agents/kotlin-review/kotlin-boundary-contract-reviewer.agent.md",
          "type": "PLUGIN_COVERAGE_REFERENCE"
        }
      ],
      "primitive": {
        "name": "kotlin-boundary-contract-reviewer",
        "primitiveType": "AGENT",
        "type": "PRIMITIVE_TARGET"
      },
      "type": "PLUGIN_COVERAGE_ENTRY"
    },
    {
      "canonicalPaths": [
        "agents/kotlin-review/kotlin-package-cohesion-reviewer.agent.md"
      ],
      "coverageStatus": "PLUGIN_COMPOSED",
      "marketplaceReferences": [],
      "pluginReferences": [
        {
          "pluginName": "kotlin-review",
          "primitivePath": "agents/kotlin-review/kotlin-package-cohesion-reviewer.agent.md",
          "type": "PLUGIN_COVERAGE_REFERENCE"
        }
      ],
      "primitive": {
        "name": "kotlin-package-cohesion-reviewer",
        "primitiveType": "AGENT",
        "type": "PRIMITIVE_TARGET"
      },
      "type": "PLUGIN_COVERAGE_ENTRY"
    },
    {
      "canonicalPaths": [
        "agents/kotlin-review/kotlin-review-captain.agent.md"
      ],
      "coverageStatus": "PLUGIN_COMPOSED",
      "marketplaceReferences": [],
      "pluginReferences": [
        {
          "pluginName": "kotlin-review",
          "primitivePath": "agents/kotlin-review/kotlin-review-captain.agent.md",
          "type": "PLUGIN_COVERAGE_REFERENCE"
        }
      ],
      "primitive": {
        "name": "kotlin-review-captain",
        "primitiveType": "AGENT",
        "type": "PRIMITIVE_TARGET"
      },
      "type": "PLUGIN_COVERAGE_ENTRY"
    },
    {
      "canonicalPaths": [
        "agents/kotlin-review/kotlin-type-safety-reviewer.agent.md"
      ],
      "coverageStatus": "PLUGIN_COMPOSED",
      "marketplaceReferences": [],
      "pluginReferences": [
        {
          "pluginName": "kotlin-review",
          "primitivePath": "agents/kotlin-review/kotlin-type-safety-reviewer.agent.md",
          "type": "PLUGIN_COVERAGE_REFERENCE"
        }
      ],
      "primitive": {
        "name": "kotlin-type-safety-reviewer",
        "primitiveType": "AGENT",
        "type": "PRIMITIVE_TARGET"
      },
      "type": "PLUGIN_COVERAGE_ENTRY"
    },
    {
      "canonicalPaths": [
        "agents/schema-type-enforcer.agent.md"
      ],
      "coverageStatus": "PLUGIN_COMPOSED",
      "marketplaceReferences": [],
      "pluginReferences": [
        {
          "pluginName": "kotlin-review",
          "primitivePath": "agents/schema-type-enforcer.agent.md",
          "type": "PLUGIN_COVERAGE_REFERENCE"
        },
        {
          "pluginName": "primitive-governance",
          "primitivePath": "agents/schema-type-enforcer.agent.md",
          "type": "PLUGIN_COVERAGE_REFERENCE"
        },
        {
          "pluginName": "schema-governance",
          "primitivePath": "agents/schema-type-enforcer.agent.md",
          "type": "PLUGIN_COVERAGE_REFERENCE"
        }
      ],
      "primitive": {
        "name": "schema-type-enforcer",
        "primitiveType": "AGENT",
        "type": "PRIMITIVE_TARGET"
      },
      "type": "PLUGIN_COVERAGE_ENTRY"
    },
    {
      "canonicalPaths": [
        "hooks/agents-md-turn-refresh.hook.json",
        "hooks/agents-md-turn-refresh.sh",
        "hooks/codex/agents-md-turn-refresh.hooks.json"
      ],
      "coverageStatus": "PLUGIN_COMPOSED",
      "marketplaceReferences": [],
      "pluginReferences": [
        {
          "pluginName": "intelligence-core",
          "primitivePath": "hooks/agents-md-turn-refresh.hook.json",
          "type": "PLUGIN_COVERAGE_REFERENCE"
        }
      ],
      "primitive": {
        "name": "agents-md-turn-refresh",
        "primitiveType": "HOOK",
        "type": "PRIMITIVE_TARGET"
      },
      "type": "PLUGIN_COVERAGE_ENTRY"
    },
    {
      "canonicalPaths": [
        "hooks/codex/kotlin-horizontalization-check.hooks.json",
        "hooks/kotlin-horizontalization-check.hook.json",
        "hooks/kotlin-horizontalization-check.py"
      ],
      "coverageStatus": "PLUGIN_COMPOSED",
      "marketplaceReferences": [],
      "pluginReferences": [
        {
          "pluginName": "kotlin-review",
          "primitivePath": "hooks/kotlin-horizontalization-check.hook.json",
          "type": "PLUGIN_COVERAGE_REFERENCE"
        }
      ],
      "primitive": {
        "name": "kotlin-horizontalization-check",
        "primitiveType": "HOOK",
        "type": "PRIMITIVE_TARGET"
      },
      "type": "PLUGIN_COVERAGE_ENTRY"
    },
    {
      "canonicalPaths": [
        "hooks/codex/required-skill-read.hooks.json",
        "hooks/required-skill-read.hook.json",
        "hooks/required-skill-read.py"
      ],
      "coverageStatus": "PLUGIN_COMPOSED",
      "marketplaceReferences": [],
      "pluginReferences": [
        {
          "pluginName": "intelligence-core",
          "primitivePath": "hooks/required-skill-read.hook.json",
          "type": "PLUGIN_COVERAGE_REFERENCE"
        }
      ],
      "primitive": {
        "name": "required-skill-read",
        "primitiveType": "HOOK",
        "type": "PRIMITIVE_TARGET"
      },
      "type": "PLUGIN_COVERAGE_ENTRY"
    },
    {
      "canonicalPaths": [
        "schemas/hooks/skill-requirements.schema.json"
      ],
      "coverageStatus": "STANDALONE_ONLY",
      "marketplaceReferences": [],
      "pluginReferences": [],
      "primitive": {
        "name": "skill-requirements-schema",
        "primitiveType": "HOOK",
        "type": "PRIMITIVE_TARGET"
      },
      "type": "PLUGIN_COVERAGE_ENTRY"
    },
    {
      "canonicalPaths": [
        "agents/AGENTS.md"
      ],
      "coverageStatus": "SCOPED_INSTRUCTION",
      "marketplaceReferences": [],
      "pluginReferences": [],
      "primitive": {
        "name": "agents-agents-instructions",
        "primitiveType": "INSTRUCTION",
        "type": "PRIMITIVE_TARGET"
      },
      "type": "PLUGIN_COVERAGE_ENTRY"
    },
    {
      "canonicalPaths": [
        "concepts/AGENTS.md"
      ],
      "coverageStatus": "SCOPED_INSTRUCTION",
      "marketplaceReferences": [],
      "pluginReferences": [],
      "primitive": {
        "name": "concepts-agents-instructions",
        "primitiveType": "INSTRUCTION",
        "type": "PRIMITIVE_TARGET"
      },
      "type": "PLUGIN_COVERAGE_ENTRY"
    },
    {
      "canonicalPaths": [
        "hooks/AGENTS.md"
      ],
      "coverageStatus": "SCOPED_INSTRUCTION",
      "marketplaceReferences": [],
      "pluginReferences": [],
      "primitive": {
        "name": "hooks-agents-instructions",
        "primitiveType": "INSTRUCTION",
        "type": "PRIMITIVE_TARGET"
      },
      "type": "PLUGIN_COVERAGE_ENTRY"
    },
    {
      "canonicalPaths": [
        "AGENTS.md"
      ],
      "coverageStatus": "SCOPED_INSTRUCTION",
      "marketplaceReferences": [],
      "pluginReferences": [],
      "primitive": {
        "name": "intelligence-agents-instructions",
        "primitiveType": "INSTRUCTION",
        "type": "PRIMITIVE_TARGET"
      },
      "type": "PLUGIN_COVERAGE_ENTRY"
    },
    {
      "canonicalPaths": [
        "concepts/schema-driven-design/core.md"
      ],
      "coverageStatus": "PLUGIN_COMPOSED",
      "marketplaceReferences": [],
      "pluginReferences": [
        {
          "pluginName": "intelligence-core",
          "primitivePath": "concepts/schema-driven-design/core.md",
          "type": "PLUGIN_COVERAGE_REFERENCE"
        },
        {
          "pluginName": "kotlin-review",
          "primitivePath": "concepts/schema-driven-design/core.md",
          "type": "PLUGIN_COVERAGE_REFERENCE"
        },
        {
          "pluginName": "primitive-authoring",
          "primitivePath": "concepts/schema-driven-design/core.md",
          "type": "PLUGIN_COVERAGE_REFERENCE"
        },
        {
          "pluginName": "primitive-governance",
          "primitivePath": "concepts/schema-driven-design/core.md",
          "type": "PLUGIN_COVERAGE_REFERENCE"
        },
        {
          "pluginName": "runtime-activation",
          "primitivePath": "concepts/schema-driven-design/core.md",
          "type": "PLUGIN_COVERAGE_REFERENCE"
        },
        {
          "pluginName": "schema-governance",
          "primitivePath": "concepts/schema-driven-design/core.md",
          "type": "PLUGIN_COVERAGE_REFERENCE"
        },
        {
          "pluginName": "tdd-workflow",
          "primitivePath": "concepts/schema-driven-design/core.md",
          "type": "PLUGIN_COVERAGE_REFERENCE"
        }
      ],
      "primitive": {
        "name": "schema-driven-design",
        "primitiveType": "INSTRUCTION",
        "type": "PRIMITIVE_TARGET"
      },
      "type": "PLUGIN_COVERAGE_ENTRY"
    },
    {
      "canonicalPaths": [
        "schemas/AGENTS.md"
      ],
      "coverageStatus": "SCOPED_INSTRUCTION",
      "marketplaceReferences": [],
      "pluginReferences": [],
      "primitive": {
        "name": "schemas-agents-instructions",
        "primitiveType": "INSTRUCTION",
        "type": "PRIMITIVE_TARGET"
      },
      "type": "PLUGIN_COVERAGE_ENTRY"
    },
    {
      "canonicalPaths": [
        "skills/AGENTS.md"
      ],
      "coverageStatus": "SCOPED_INSTRUCTION",
      "marketplaceReferences": [],
      "pluginReferences": [],
      "primitive": {
        "name": "skills-agents-instructions",
        "primitiveType": "INSTRUCTION",
        "type": "PRIMITIVE_TARGET"
      },
      "type": "PLUGIN_COVERAGE_ENTRY"
    },
    {
      "canonicalPaths": [
        "concepts/type-safety/core.md"
      ],
      "coverageStatus": "PLUGIN_COMPOSED",
      "marketplaceReferences": [],
      "pluginReferences": [
        {
          "pluginName": "intelligence-core",